{
  "CacheClusterId": "example-value",
  "ARN": "example-value",
  "CacheClusterStatus": "creating",
  "Engine": "memcached",
  "EngineVersion": "example-value",
  "CacheNodeType": "example-value",
  "NumCacheNodes": 70,
  "PreferredAvailabilityZone": "example-value",
  "CacheClusterCreateTime": "2025-01-15T00:00:00Z",
  "PreferredMaintenanceWindow": "example-value"
}